{"$schema": "https://uidl.dev/schema/v1/conformance-case.schema.json", "id": "theme-resolve-typography-token", "class": "theme", "status": "active", "spec": "v1", "input": {"theme": "default-light", "ref": "semantics.typography.headline-medium"}, "context": {}, "expected": {"fontFamily": "{primitives.font.sans}", "fontSize": "text-2xl", "fontWeight": 600, "lineHeight": "leading-snug", "letterSpacing": "tracking-tight"}}
