{
  "$schema": "https://uidl.dev/schema/v1/conformance-case.schema.json",
  "id": "set-state-writes",
  "class": "action-exec",
  "status": "active",
  "spec": "v1",
  "input": { "setState": { "path": "count", "value": 5 } },
  "context": { "state": { "count": 0 } },
  "expected": { "ok": true, "state": { "count": 5 } }
}
