{
  "$schema": "https://uidl.dev/schema/v1/conformance-case.schema.json",
  "id": "contains-string",
  "class": "expression",
  "status": "active",
  "spec": "v1",
  "input": {
    "op": "contains",
    "left": {"literal": "hello world"},
    "right": {"literal": "world"}
  },
  "context": {},
  "expected": true
}
